<?xml version="1.0" encoding="UTF-8"?>
<?xml-stylesheet type="text/xsl" href="cubestohtml.xsl"?>
<rubiksProject xmlns:xsi="http://www.w3.org/2001/XMLSchema-instance"
  xsi:noNamespaceSchemaLocation="cubes.xsd">

  <inventor source="https://en.wikipedia.org/wiki/Ern%C5%91_Rubik">
    <name>Ernő Rubik</name>
    <yearofbirth>1944</yearofbirth>
    <nationality>Węgierskie</nationality>
    <profession>Architekt</profession>
    <awards>
      <award>
        <name>Wielki Krzyż Orderu Świętego Stefana</name>
        <year>2014</year>
      </award>
    </awards>
  </inventor>

  <methods>

    <method name="LBL" lang="pl" year="1975">
      <description> To najprostsza i najbardziej intuicyjna metoda, od której zaczyna większość
        początkujących. <term>lookahead</term> oraz <term>intuicja</term> odgrywają kluczową rolę. </description>
      <difficulty>easy</difficulty>
      <steps>
        <step number="1">Ułożenie krzyża na pierwszej warstwie (zazwyczaj białej)</step>
        <step number="2">Dokończenie pierwszej warstwy poprzez ustawienie rogów</step>
        <step number="3">Ułożenie drugiej warstwy — dopasowanie krawędzi</step>
        <step number="4">Ułożenie krzyża na ostatniej warstwie</step>
        <step number="5">Ustawienie ostatnich elementów (OLL i PLL w prostszej formie)</step>
      </steps>
      <links>
        <link type="html">lbl.html</link>
        <link type="video">https://youtube.com/watch?v=lbl_tutorial</link>
      </links>
      <gallery>
        <image src="images/lbl.png" content="LBL 3x3 method" width="400" height="300" />
        <image src="images/basic_moves.png" content="LBL sample solve" width="400" height="300"/>
      </gallery>
    </method>

    <method name="CFOP" creator="Jessica Fridrich" year="1981" lang="pl">
      <description> Najpopularniejsza metoda wśród speedcuberów, znana również jako metoda
        Fridrich'a. </description>
      <difficulty>medium high</difficulty>
      <steps>
        <step number="1" name="Cross">Ułożenie krzyża na dolnej warstwie</step>
        <step number="2" name="F2L">Jednoczesne układanie dwóch pierwszych warstw poprzez parowanie
          krawędzi i rogów</step>
        <step number="3" name="OLL">Ustawienie wszystkich elementów ostatniej warstwy w odpowiednim
          kierunku.</step>
        <step number="4" name="PLL">Ustawienie elementów ostatniej warstwy na właściwych pozycjach.</step>
      </steps>

      <links>
        <link type="html">fridrich.html</link>
        <link type="pdf">cfop_guide.html</link>
      </links>
      <image src="images/cfop.png" content="CFOP / Fridrich 3x3 method" width="500" height="350" />
    </method>

    <method name="Roux" creator="Gilles Roux" year="2003" lang="pl">
      <description> Metoda Roux, stworzona przez francuskiego speedcubera Gilles’a Roux, jest mniej
        popularna niż CFOP, ale zyskuje coraz więcej zwolenników ze względu na swoją efektywność i
        logiczne podejście. </description>
      <difficulty>easy medium</difficulty>
      <steps>
        <step number="1">Zbudowanie dwóch 1×2×3 bloków po lewej i prawej stronie kostki</step>
        <step number="2">Ułożenie środkowej warstwy (M-slice)</step>
        <step number="3">Ustawienie i orientacja ostatnich czterech rogów</step>
        <step number="4">Ukończenie środkowych krawędzi i dopasowanie całości</step>
      </steps>
      <links>
        <link type="html">roux.html</link>
      </links>
      <image src="images/roux.png" content="Roux 3x3 method" />
    </method>

    <method name="ZZ" creator="Zbigniew Zborowski" year="2006" lang="pl">
      <description> Metoda ZZ pozwala ograniczyć użycie obrotów w osi U i poprawia ergonomię ułożeń. </description>
      <difficulty>8/10</difficulty>
      <steps>
        <step number="1">Etap EOLine — orientacja krawędzi i utworzenie linii</step>
        <step number="2">Blokowanie lewej i prawej strony (F2L)</step>
        <step number="3">Zakończenie górnej warstwy OLL/PLL</step>
      </steps>
      <links>
        <link type="html">zz.html</link>
        <link type="video">https://youtube.com/watch?v=zz_tutorial</link>
      </links>
      <gallery>
        <image src="images/zz.png" content="ZZ EOLine" width="400" />
      </gallery>
    </method>

  </methods>

  <training lang="pl">
    <tip>Ćwicz regularnie krótkie sesje (10–15 minut dziennie) zamiast długich, rzadkich treningów.</tip>
    <tip>Nagrywaj swoje ułożenia, aby analizować błędy i nieefektywne ruchy.</tip>
    <tip>Spróbuj metody <term>lookahead</term> — patrz z wyprzedzeniem na kolejne elementy zamiast
      zatrzymywać się między ruchami.</tip>
    <tip>Analizuj <term>algorytmy</term> i szukaj ich prostszych odpowiedników, aby zmniejszyć
      liczbę ruchów.</tip>
    <tip>Używaj timerów online, takich jak <link type="external">https://cstimer.net/</link> czy <link
        type="external">https://cubeast.com/</link>. </tip>
  </training>

  <recommendations>
    <beginner>Zacznij od LBL, aby zrozumieć podstawy.</beginner>
    <intermediate>Przejdź do CFOP — to najczęściej wybierana metoda zawodników.</intermediate>
    <advanced>Spróbuj Roux lub ZZ, docenisz ich sprytną strukturę i optymalizację ruchów.</advanced>
    <note>Bez względu na metodę, kluczem do sukcesu są regularne treningi i zrozumienie mechaniki
      kostki.</note>
  </recommendations>

  <resources>
    <youtubeChannel>J Perm</youtubeChannel>
    <youtubeChannel>Cubing Encoded</youtubeChannel>
    <youtubeChannel>SpeedCubeReview</youtubeChannel>
  </resources>

</rubiksProject>
